{
  "spec_version": "agenomic.rmp/v0.1",
  "alert_id": "alr_01JZWX7Q3K",
  "session_id": "prt_01JZWX7P9A",
  "agent_id": "agent://treans/claims-agent",
  "severity": "critical",
  "status": "open",
  "title": "Tool outside release baseline: shell.exec",
  "message": "tool.call.completed for shell.exec — not in the genome's allowed tools",
  "created_at": "2026-07-11T09:20:00Z",
  "finding_ids": ["fnd_drift_1", "fnd_drift_2"],
  "dedup_key": "drift:agent://treans/claims-agent:Tool outside release baseline: shell.exec",
  "occurrence_count": 2,
  "routes": [
    {"target": "ml-platform", "channel": "slack", "routed_at": "2026-07-11T09:20:00Z"}
  ],
  "evidence_refs": ["evt_01JZWX3A", "evt_01JZWX4C", "ledger:01JZWX3B"],
  "throttled": false,
  "escalated": true
}
